{
  "$schema": "https://json-schema.org/draft/2020-12/schema",
  "$id": "https://agentreadyvideo.org/schema/1.0/moment.schema.json",
  "title": "ARV Moment",
  "description": "A range on an asset. Identity is the canonical range after snapping. Chapters, shots, windows and spans are all moments; kind labels which one the origin published. end_ms stays on the moment for rights and receipts; players do not enforce it.",
  "type": "object",
  "required": [
    "arv",
    "id",
    "moment_uri",
    "asset_id",
    "start_ms",
    "end_ms"
  ],
  "properties": {
    "arv": {
      "const": "1.0",
      "description": "ARV version. Every ARV object carries \"arv\": \"1.0\"."
    },
    "id": {
      "type": "string",
      "pattern": "^mom_[a-z2-7]{26}$",
      "description": "\"mom_\" + first 26 characters of lowercase base32 (RFC 4648, no padding) of SHA-256 over \"{origin}|{asset_id}|{start_ms}|{end_ms}\". Recomputable by anyone."
    },
    "moment_uri": {
      "type": "string",
      "pattern": "^arv:[^#\\s]+#t=\\d+,\\d+$",
      "description": "arv:{asset_id}#t={start_ms},{end_ms}. The canonical snapped range is the moment's identity."
    },
    "moment_url": {
      "type": "string",
      "format": "uri",
      "description": "https deep link that opens the video at start_ms, using a start-only Media Fragment in seconds (#t=12.4) or the player's own start parameter. It MUST NOT carry an end in a Media Fragment, because players stop at a fragment end.",
      "not": {
        "pattern": "#t=[^&#]*,"
      }
    },
    "asset_id": {
      "type": "string",
      "minLength": 1
    },
    "start_ms": {
      "type": "integer",
      "minimum": 0
    },
    "end_ms": {
      "type": "integer",
      "minimum": 0
    },
    "snap": {
      "enum": [
        "shot",
        "sentence",
        "word",
        "silence",
        "rights_cap"
      ],
      "description": "The snap rule used. Omitted when the producer does not know it."
    },
    "kind": {
      "enum": [
        "chapter",
        "shot",
        "window",
        "span"
      ],
      "description": "What the origin published this range as: chapter (a titled section), shot (one continuous camera take), window (a short range used for visual description) or span (any other evidence-backed range). Optional. It never changes the moment's identity."
    },
    "title": {
      "type": "string"
    },
    "summary": {
      "type": "string",
      "description": "A short plain summary of the range."
    },
    "visual_description": {
      "type": "string",
      "description": "What is on screen in the range, in plain words."
    },
    "evidence": {
      "type": "array",
      "description": "Typed spans, each fully inside [start_ms, end_ms].",
      "items": {
        "$ref": "#/$defs/evidence_span"
      }
    },
    "evidence_grade": {
      "enum": [
        "A",
        "B",
        "C",
        "D"
      ],
      "description": "A human-verified; B machine-produced and passed an automated quality check that the producer documents publicly; C machine-produced with at least one direct span inside the range; D metadata or inference only."
    },
    "confidence": {
      "type": "object",
      "required": [
        "score",
        "band"
      ],
      "properties": {
        "score": {
          "type": "number",
          "minimum": 0,
          "maximum": 1
        },
        "band": {
          "enum": [
            "low",
            "medium",
            "high"
          ]
        }
      }
    },
    "aliases": {
      "type": "array",
      "items": {
        "type": "string"
      },
      "description": "Earlier ids for the same moment, for example an id from an older numbering scheme, so old references keep resolving."
    },
    "products": {
      "type": "array",
      "description": "Products, services or works the range shows or mentions. Discovery data: never a media URL.",
      "items": {
        "$ref": "#/$defs/product"
      }
    },
    "actions": {
      "type": "array",
      "description": "Links the publisher offers the viewer (buy, book, subscribe, learn). Separate from entitlement and playback.",
      "items": {
        "$ref": "#/$defs/action"
      }
    }
  },
  "additionalProperties": true,
  "$defs": {
    "evidence_span": {
      "type": "object",
      "required": [
        "type",
        "start_ms",
        "end_ms"
      ],
      "properties": {
        "type": {
          "enum": [
            "transcript",
            "on_screen_text",
            "shot_caption",
            "visual"
          ]
        },
        "start_ms": {
          "type": "integer",
          "minimum": 0
        },
        "end_ms": {
          "type": "integer",
          "minimum": 0
        },
        "text": {
          "type": "string"
        },
        "confidence": {
          "type": "number",
          "minimum": 0,
          "maximum": 1
        },
        "speaker_id": {
          "type": "string",
          "description": "On a transcript span: the id of the speaker in the asset's speakers list."
        }
      },
      "description": "A typed span of evidence. Times are absolute milliseconds on the asset."
    },
    "product": {
      "type": "object",
      "description": "A product, service or work that a range shows or mentions.",
      "required": [
        "name"
      ],
      "properties": {
        "name": {
          "type": "string",
          "minLength": 1
        },
        "brand": {
          "type": "string"
        },
        "kind": {
          "enum": [
            "physical_product",
            "software",
            "online_service",
            "service",
            "game",
            "book",
            "film_or_show",
            "music_or_podcast"
          ],
          "description": "service is something a person books or receives from a provider (an appointment, a class). online_service is a website or platform a person uses."
        },
        "relation": {
          "enum": [
            "shown",
            "mentioned"
          ],
          "description": "shown: on screen. mentioned: named in speech or text only."
        },
        "url": {
          "type": "string",
          "format": "uri",
          "pattern": "^https://",
          "description": "https link to the merchant or publisher page. Never a media URL."
        },
        "evidence": {
          "type": "array",
          "description": "Spans where the product appears. Inside the moment range on a Moment, inside duration_ms on an Asset.",
          "items": {
            "$ref": "#/$defs/evidence_span"
          }
        }
      }
    },
    "action": {
      "type": "object",
      "description": "A link the publisher offers the viewer. It is an offer, not an access requirement: entitlement and payment stay in RightsSummary and PlaybackDescriptor.",
      "required": [
        "label",
        "action",
        "url"
      ],
      "properties": {
        "label": {
          "type": "string",
          "minLength": 1,
          "description": "The text a consumer shows, for example \"Book a tune-up\"."
        },
        "action": {
          "enum": [
            "buy",
            "book",
            "subscribe",
            "learn"
          ]
        },
        "kind": {
          "$ref": "#/$defs/product/properties/kind"
        },
        "url": {
          "type": "string",
          "format": "uri",
          "pattern": "^https://",
          "description": "https link the viewer opens. Never a media URL that plays without an origin check."
        }
      }
    }
  }
}
