{
  "arv": "1.0",
  "id": "mom_rg2e4kdenkmkzilboihacumshn",
  "moment_uri": "arv:vid_8f2c#t=12400,31000",
  "moment_url": "https://example.com/videos/carb#t=12.4",
  "asset_id": "vid_8f2c",
  "start_ms": 12400,
  "end_ms": 31000,
  "snap": "sentence",
  "kind": "span",
  "title": "Setting the idle mixture screw",
  "evidence": [
    {
      "type": "transcript",
      "start_ms": 12900,
      "end_ms": 18200,
      "text": "Turn the mixture screw a quarter turn out",
      "confidence": 0.93,
      "speaker_id": "spk_1"
    },
    {
      "type": "shot_caption",
      "start_ms": 14000,
      "end_ms": 22000,
      "text": "Close-up of a screwdriver on the idle screw",
      "confidence": 0.81
    }
  ],
  "evidence_grade": "C",
  "confidence": {
    "score": 0.84,
    "band": "high"
  },
  "products": [
    {
      "name": "Flat-blade screwdriver",
      "kind": "physical_product",
      "relation": "shown",
      "url": "https://example.com/tools/flat-screwdriver",
      "evidence": [
        {
          "type": "shot_caption",
          "start_ms": 14000,
          "end_ms": 22000,
          "text": "Close-up of a screwdriver on the idle screw"
        }
      ]
    }
  ],
  "aliases": [
    "legacy_2b7c"
  ]
}
